{
  "schemaVersion": 10,
  "id": "nivel-01",
  "name": "Hola, mundo",
  "description": "Tutorial. Apuntá a la X o al botón: un tiro al cuerpo de la ventana la atraviesa. Cada sala se sella hasta que cae su último bloque.",
  "timeLimitSeconds": 80,
  "gridSize": 1,
  "startingAmmo": {
    "magazine": 10,
    "reserve": 12
  },
  "sky": "clear-day",
  "defaults": {
    "wallHeight": 6,
    "maxBlockHeight": 6,
    "hasCeiling": true,
    "corridorWidth": 3.5,
    "textures": {
      "walls": "plaster/plaster-02",
      "floor": "tile/tile-03",
      "ceiling": "plaster/plaster-01",
      "door": "wood/wood-01",
      "block": "metal/metal-01"
    }
  },
  "rooms": [
    {
      "id": "05ec79cb-4eae-510c-8533-7db3f7e0d83c",
      "name": "Escritorio",
      "type": "custom",
      "role": "start",
      "position": {
        "x": 0,
        "z": 0
      },
      "size": {
        "width": 8,
        "depth": 8
      },
      "entry": {
        "wall": "west",
        "offset": 0
      },
      "facing": 90,
      "wallHeight": 4,
      "hasCeiling": null,
      "ammoReward": {
        "enabled": false,
        "amount": 30,
        "color": "#f4bc59"
      },
      "radio": {
        "enabled": true,
        "corner": "nw"
      },
      "textures": {
        "walls": "wood/wood-04",
        "floor": "wood/wood-08",
        "ceiling": "plaster/plaster-01",
        "door": "",
        "block": ""
      },
      "waves": [
        {
          "blocks": {
            "left": {
              "enabled": false,
              "movement": "static",
              "movementSpeed": 0.65,
              "color": "#2ed5c5",
              "layers": []
            },
            "front": {
              "enabled": false,
              "movement": "static",
              "movementSpeed": 0.65,
              "color": "#2ed5c5",
              "layers": []
            },
            "right": {
              "enabled": false,
              "movement": "static",
              "movementSpeed": 0.65,
              "color": "#2ed5c5",
              "layers": []
            }
          }
        }
      ]
    },
    {
      "id": "8f7d1441-8ad9-58f7-a5ea-2a879ea7c199",
      "name": "Bandeja de entrada",
      "type": "custom",
      "role": "transition",
      "position": {
        "x": 16,
        "z": 0
      },
      "size": {
        "width": 12,
        "depth": 12
      },
      "entry": {
        "wall": "west",
        "offset": 0
      },
      "facing": 0,
      "wallHeight": null,
      "hasCeiling": null,
      "ammoReward": {
        "enabled": false,
        "amount": 30,
        "color": "#f4bc59"
      },
      "radio": {
        "enabled": false,
        "corner": "ne"
      },
      "textures": {
        "walls": "",
        "floor": "",
        "ceiling": "",
        "door": "",
        "block": ""
      },
      "waves": [
        {
          "blocks": {
            "left": {
              "enabled": false,
              "movement": "static",
              "movementSpeed": 0.65,
              "color": "#2ed5c5",
              "layers": []
            },
            "front": {
              "enabled": true,
              "movement": "static",
              "movementSpeed": 0.65,
              "color": "#2ed5c5",
              "layers": [
                {
                  "windows": {
                    "custom:bienvenida": 4
                  }
                }
              ]
            },
            "right": {
              "enabled": false,
              "movement": "static",
              "movementSpeed": 0.65,
              "color": "#2ed5c5",
              "layers": []
            }
          }
        }
      ]
    },
    {
      "id": "593744a3-1d10-5573-a453-56735bf4e633",
      "name": "Galería",
      "type": "custom",
      "role": "transition",
      "position": {
        "x": 37,
        "z": 0
      },
      "size": {
        "width": 18,
        "depth": 10
      },
      "entry": {
        "wall": "west",
        "offset": 0
      },
      "facing": 0,
      "wallHeight": null,
      "hasCeiling": null,
      "ammoReward": {
        "enabled": false,
        "amount": 30,
        "color": "#f4bc59"
      },
      "radio": {
        "enabled": false,
        "corner": "ne"
      },
      "textures": {
        "walls": "",
        "floor": "",
        "ceiling": "",
        "door": "",
        "block": ""
      },
      "waves": [
        {
          "blocks": {
            "left": {
              "enabled": false,
              "movement": "static",
              "movementSpeed": 0.65,
              "color": "#2ed5c5",
              "layers": []
            },
            "front": {
              "enabled": true,
              "movement": "static",
              "movementSpeed": 0.65,
              "color": "#2ed5c5",
              "layers": [
                {
                  "windows": {
                    "normal": 6
                  }
                }
              ]
            },
            "right": {
              "enabled": false,
              "movement": "static",
              "movementSpeed": 0.65,
              "color": "#2ed5c5",
              "layers": []
            }
          }
        }
      ]
    },
    {
      "id": "880a9ab3-2314-5146-89ce-64d12312fbbf",
      "name": "Salida",
      "type": "custom",
      "role": "exit",
      "position": {
        "x": 55,
        "z": 0
      },
      "size": {
        "width": 8,
        "depth": 8
      },
      "entry": {
        "wall": "west",
        "offset": 0
      },
      "facing": 0,
      "wallHeight": 5,
      "hasCeiling": false,
      "ammoReward": {
        "enabled": false,
        "amount": 30,
        "color": "#f4bc59"
      },
      "radio": {
        "enabled": true,
        "corner": "ne"
      },
      "textures": {
        "walls": "bricks/brick-02",
        "floor": "grass/grass-03",
        "ceiling": "",
        "door": "",
        "block": ""
      },
      "waves": [
        {
          "blocks": {
            "left": {
              "enabled": false,
              "movement": "static",
              "movementSpeed": 0.65,
              "color": "#2ed5c5",
              "layers": []
            },
            "front": {
              "enabled": false,
              "movement": "static",
              "movementSpeed": 0.65,
              "color": "#2ed5c5",
              "layers": []
            },
            "right": {
              "enabled": false,
              "movement": "static",
              "movementSpeed": 0.65,
              "color": "#2ed5c5",
              "layers": []
            }
          }
        }
      ]
    }
  ],
  "connections": [
    {
      "id": "9799e630-c36f-59cf-a596-da29dce1e508",
      "fromRoomId": "05ec79cb-4eae-510c-8533-7db3f7e0d83c",
      "toRoomId": "8f7d1441-8ad9-58f7-a5ea-2a879ea7c199",
      "fromWall": "east",
      "toWall": "west",
      "width": 3.5,
      "waypoints": []
    },
    {
      "id": "c1f613d5-578a-56ce-abcb-8b3cde4d28d1",
      "fromRoomId": "8f7d1441-8ad9-58f7-a5ea-2a879ea7c199",
      "toRoomId": "593744a3-1d10-5573-a453-56735bf4e633",
      "fromWall": "east",
      "toWall": "west",
      "width": 3.5,
      "waypoints": []
    },
    {
      "id": "6b8d51e0-a076-5608-b717-8395c2e72c75",
      "fromRoomId": "593744a3-1d10-5573-a453-56735bf4e633",
      "toRoomId": "880a9ab3-2314-5146-89ce-64d12312fbbf",
      "fromWall": "east",
      "toWall": "west",
      "width": 3,
      "waypoints": []
    }
  ]
}
