{
  "schemaVersion": 10,
  "id": "nivel-02",
  "name": "Actualizaciones pendientes",
  "description": "Capas: limpiar la pantalla no siempre cierra el bloque. Recargá (R) cuando la pared se vacía, no cuando el cargador se vacía.",
  "timeLimitSeconds": 95,
  "gridSize": 1,
  "startingAmmo": {
    "magazine": 10,
    "reserve": 14
  },
  "sky": "clear-day",
  "defaults": {
    "wallHeight": 6,
    "maxBlockHeight": 6,
    "hasCeiling": true,
    "corridorWidth": 3.5,
    "textures": {
      "walls": "plaster/plaster-04",
      "floor": "tile/tile-06",
      "ceiling": "plaster/plaster-02",
      "door": "wood/wood-01",
      "block": "metal/metal-01"
    }
  },
  "rooms": [
    {
      "id": "5da689d1-67a2-564a-b276-fb039d3355bd",
      "name": "Recepción",
      "type": "custom",
      "role": "start",
      "position": {
        "x": 0,
        "z": 0
      },
      "size": {
        "width": 8,
        "depth": 8
      },
      "entry": {
        "wall": "south",
        "offset": 0
      },
      "facing": 0,
      "wallHeight": 4,
      "hasCeiling": null,
      "ammoReward": {
        "enabled": false,
        "amount": 30,
        "color": "#f4bc59"
      },
      "radio": {
        "enabled": true,
        "corner": "se"
      },
      "textures": {
        "walls": "wood/wood-04",
        "floor": "wood/wood-08",
        "ceiling": "plaster/plaster-01",
        "door": "",
        "block": ""
      },
      "waves": [
        {
          "blocks": {
            "left": {
              "enabled": false,
              "movement": "static",
              "movementSpeed": 0.65,
              "color": "#2ed5c5",
              "layers": []
            },
            "front": {
              "enabled": false,
              "movement": "static",
              "movementSpeed": 0.65,
              "color": "#2ed5c5",
              "layers": []
            },
            "right": {
              "enabled": false,
              "movement": "static",
              "movementSpeed": 0.65,
              "color": "#2ed5c5",
              "layers": []
            }
          }
        }
      ]
    },
    {
      "id": "00a26c97-eef8-5b93-9193-19fcab29e132",
      "name": "Parches",
      "type": "custom",
      "role": "transition",
      "position": {
        "x": 0,
        "z": -16
      },
      "size": {
        "width": 12,
        "depth": 12
      },
      "entry": {
        "wall": "south",
        "offset": 0
      },
      "facing": 0,
      "wallHeight": null,
      "hasCeiling": null,
      "ammoReward": {
        "enabled": true,
        "amount": 8,
        "color": "#f4bc59"
      },
      "radio": {
        "enabled": false,
        "corner": "ne"
      },
      "textures": {
        "walls": "",
        "floor": "",
        "ceiling": "",
        "door": "",
        "block": ""
      },
      "waves": [
        {
          "blocks": {
            "left": {
              "enabled": false,
              "movement": "static",
              "movementSpeed": 0.65,
              "color": "#2ed5c5",
              "layers": []
            },
            "front": {
              "enabled": true,
              "movement": "static",
              "movementSpeed": 0.65,
              "color": "#2ed5c5",
              "layers": [
                {
                  "windows": {
                    "custom:actualizacion": 3
                  }
                },
                {
                  "windows": {
                    "normal": 4
                  }
                }
              ]
            },
            "right": {
              "enabled": false,
              "movement": "static",
              "movementSpeed": 0.65,
              "color": "#2ed5c5",
              "layers": []
            }
          }
        }
      ]
    },
    {
      "id": "c75f524b-3fad-570a-b064-79d3940aabbb",
      "name": "Cebolla",
      "type": "custom",
      "role": "transition",
      "position": {
        "x": 18,
        "z": -16
      },
      "size": {
        "width": 14,
        "depth": 14
      },
      "entry": {
        "wall": "west",
        "offset": 0
      },
      "facing": 0,
      "wallHeight": null,
      "hasCeiling": null,
      "ammoReward": {
        "enabled": false,
        "amount": 30,
        "color": "#f4bc59"
      },
      "radio": {
        "enabled": false,
        "corner": "ne"
      },
      "textures": {
        "walls": "",
        "floor": "",
        "ceiling": "",
        "door": "",
        "block": ""
      },
      "waves": [
        {
          "blocks": {
            "left": {
              "enabled": false,
              "movement": "static",
              "movementSpeed": 0.65,
              "color": "#2ed5c5",
              "layers": []
            },
            "front": {
              "enabled": true,
              "movement": "static",
              "movementSpeed": 0.65,
              "color": "#2ed5c5",
              "layers": [
                {
                  "windows": {
                    "normal": 4
                  }
                },
                {
                  "windows": {
                    "custom:actualizacion": 5
                  }
                }
              ]
            },
            "right": {
              "enabled": false,
              "movement": "static",
              "movementSpeed": 0.65,
              "color": "#2ed5c5",
              "layers": []
            }
          }
        }
      ]
    },
    {
      "id": "78ea1b3a-855a-560f-99ea-45c369e09fff",
      "name": "Salida",
      "type": "custom",
      "role": "exit",
      "position": {
        "x": 34,
        "z": -16
      },
      "size": {
        "width": 8,
        "depth": 8
      },
      "entry": {
        "wall": "west",
        "offset": 0
      },
      "facing": 0,
      "wallHeight": 5,
      "hasCeiling": false,
      "ammoReward": {
        "enabled": false,
        "amount": 30,
        "color": "#f4bc59"
      },
      "radio": {
        "enabled": true,
        "corner": "nw"
      },
      "textures": {
        "walls": "bricks/brick-02",
        "floor": "grass/grass-03",
        "ceiling": "",
        "door": "",
        "block": ""
      },
      "waves": [
        {
          "blocks": {
            "left": {
              "enabled": false,
              "movement": "static",
              "movementSpeed": 0.65,
              "color": "#2ed5c5",
              "layers": []
            },
            "front": {
              "enabled": false,
              "movement": "static",
              "movementSpeed": 0.65,
              "color": "#2ed5c5",
              "layers": []
            },
            "right": {
              "enabled": false,
              "movement": "static",
              "movementSpeed": 0.65,
              "color": "#2ed5c5",
              "layers": []
            }
          }
        }
      ]
    }
  ],
  "connections": [
    {
      "id": "86a7061a-1474-5eef-a52b-23277f1aa851",
      "fromRoomId": "5da689d1-67a2-564a-b276-fb039d3355bd",
      "toRoomId": "00a26c97-eef8-5b93-9193-19fcab29e132",
      "fromWall": "north",
      "toWall": "south",
      "width": 3.5,
      "waypoints": []
    },
    {
      "id": "2f7abf19-34ba-5cf4-8b69-23925f4e0132",
      "fromRoomId": "00a26c97-eef8-5b93-9193-19fcab29e132",
      "toRoomId": "c75f524b-3fad-570a-b064-79d3940aabbb",
      "fromWall": "east",
      "toWall": "west",
      "width": 3.5,
      "waypoints": []
    },
    {
      "id": "7b907d5c-b1b9-5435-b73e-dd82bc90b193",
      "fromRoomId": "c75f524b-3fad-570a-b064-79d3940aabbb",
      "toRoomId": "78ea1b3a-855a-560f-99ea-45c369e09fff",
      "fromWall": "east",
      "toWall": "west",
      "width": 3,
      "waypoints": []
    }
  ]
}
